[
  {
    "id": "a004",
    "question_id": "q01",
    "student_answer": "Object-oriented programming is one of the most widely taught paradigms in computer science. Encapsulation is the principle of bundling an object's data and behavior together while restricting direct access to its internal state.",
    "reference_answer": "Encapsulation is the OOP principle of bundling data and the methods that operate on that data within a single unit, typically a class, while restricting direct access to some of the object's components. Access modifiers such as private, protected, and public control the visibility of fields and methods, enforcing information hiding. By making fields private and exposing controlled access through getters and setters, a class can validate changes to its internal state and hide implementation details from the outside world. This reduces coupling between classes and makes code easier to maintain and refactor.",
    "concepts": [
      "encapsulation",
      "access modifiers",
      "getters and setters",
      "data hiding",
      "private fields"
    ],
    "sentence_roles": [
      {
        "text": "Object-oriented programming is one of the most widely taught paradigms in computer science.",
        "role": "Other"
      },
      {
        "text": "Encapsulation is the principle of bundling an object's data and behavior together while restricting direct access to its internal state.",
        "role": "Claim"
      }
    ],
    "concepts_present": [
      "encapsulation",
      "access modifiers",
      "data hiding"
    ],
    "support_pairs": [
      {
        "i": 0,
        "j": 1,
        "label": "Neutral"
      }
    ],
    "depth_score": 0.2502,
    "stars": 2,
    "stars_continuous": 2.45,
    "quality_tier": "weak"
  },
  {
    "id": "a002",
    "question_id": "q01",
    "student_answer": "Encapsulation is the principle of bundling an object's data and behavior together while restricting direct access to its internal state. For example, access modifiers like private, protected, and public are used to control which fields and methods can be seen from outside the class. This is because hiding the internal fields prevents other parts of the program from making the object enter an invalid state. For instance, a class can expose getter and setter methods instead of allowing direct access to a private field. In conclusion, encapsulation and access modifiers work together to achieve data hiding and reduce coupling between classes.",
    "reference_answer": "Encapsulation is the OOP principle of bundling data and the methods that operate on that data within a single unit, typically a class, while restricting direct access to some of the object's components. Access modifiers such as private, protected, and public control the visibility of fields and methods, enforcing information hiding. By making fields private and exposing controlled access through getters and setters, a class can validate changes to its internal state and hide implementation details from the outside world. This reduces coupling between classes and makes code easier to maintain and refactor.",
    "concepts": [
      "encapsulation",
      "access modifiers",
      "getters and setters",
      "data hiding",
      "private fields"
    ],
    "sentence_roles": [
      {
        "text": "Encapsulation is the principle of bundling an object's data and behavior together while restricting direct access to its internal state.",
        "role": "Claim"
      },
      {
        "text": "For example, access modifiers like private, protected, and public are used to control which fields and methods can be seen from outside the class.",
        "role": "Evidence"
      },
      {
        "text": "This is because hiding the internal fields prevents other parts of the program from making the object enter an invalid state.",
        "role": "Explanation"
      },
      {
        "text": "For instance, a class can expose getter and setter methods instead of allowing direct access to a private field.",
        "role": "Evidence"
      },
      {
        "text": "In conclusion, encapsulation and access modifiers work together to achieve data hiding and reduce coupling between classes.",
        "role": "Conclusion"
      }
    ],
    "concepts_present": [
      "encapsulation",
      "access modifiers",
      "data hiding",
      "private fields"
    ],
    "support_pairs": [
      {
        "i": 0,
        "j": 1,
        "label": "Supports"
      },
      {
        "i": 1,
        "j": 2,
        "label": "Supports"
      },
      {
        "i": 2,
        "j": 3,
        "label": "Supports"
      },
      {
        "i": 3,
        "j": 4,
        "label": "Neutral"
      }
    ],
    "depth_score": 0.9334,
    "stars": 4,
    "stars_continuous": 4.2,
    "quality_tier": "good"
  },
  {
    "id": "a003",
    "question_id": "q01",
    "student_answer": "Encapsulation is the principle of bundling an object's data and behavior together while restricting direct access to its internal state. For example, access modifiers like private, protected, and public are used to control which fields and methods can be seen from outside the class. Object-oriented programming is one of the most widely taught paradigms in computer science.",
    "reference_answer": "Encapsulation is the OOP principle of bundling data and the methods that operate on that data within a single unit, typically a class, while restricting direct access to some of the object's components. Access modifiers such as private, protected, and public control the visibility of fields and methods, enforcing information hiding. By making fields private and exposing controlled access through getters and setters, a class can validate changes to its internal state and hide implementation details from the outside world. This reduces coupling between classes and makes code easier to maintain and refactor.",
    "concepts": [
      "encapsulation",
      "access modifiers",
      "getters and setters",
      "data hiding",
      "private fields"
    ],
    "sentence_roles": [
      {
        "text": "Encapsulation is the principle of bundling an object's data and behavior together while restricting direct access to its internal state.",
        "role": "Claim"
      },
      {
        "text": "For example, access modifiers like private, protected, and public are used to control which fields and methods can be seen from outside the class.",
        "role": "Evidence"
      },
      {
        "text": "Object-oriented programming is one of the most widely taught paradigms in computer science.",
        "role": "Other"
      }
    ],
    "concepts_present": [
      "encapsulation",
      "access modifiers",
      "data hiding",
      "private fields"
    ],
    "support_pairs": [
      {
        "i": 0,
        "j": 1,
        "label": "Supports"
      },
      {
        "i": 1,
        "j": 2,
        "label": "Neutral"
      }
    ],
    "depth_score": 0.5339,
    "stars": 3,
    "stars_continuous": 3.46,
    "quality_tier": "average"
  },
  {
    "id": "a009",
    "question_id": "q02",
    "student_answer": "Many popular programming languages such as Java, C++, and Python support these object-oriented features. Inheritance allows a class to acquire the properties and methods of another class, while polymorphism allows objects of different classes to be treated through a common interface.",
    "reference_answer": "Inheritance allows a class to acquire the fields and methods of another class, enabling code reuse through a parent-child relationship. Polymorphism allows objects of different classes to be treated through a common interface, most commonly via method overriding, so that the same method call can produce different behavior depending on the runtime type of the object. Abstract classes and interfaces often combine both concepts by defining a shared contract that subclasses implement in their own way.",
    "concepts": [
      "inheritance",
      "polymorphism",
      "method overriding",
      "abstract classes",
      "code reuse"
    ],
    "sentence_roles": [
      {
        "text": "Many popular programming languages such as Java, C++, and Python support these object-oriented features.",
        "role": "Other"
      },
      {
        "text": "Inheritance allows a class to acquire the properties and methods of another class, while polymorphism allows objects of different classes to be treated through a common interface.",
        "role": "Claim"
      }
    ],
    "concepts_present": [
      "inheritance",
      "polymorphism",
      "abstract classes"
    ],
    "support_pairs": [
      {
        "i": 0,
        "j": 1,
        "label": "Neutral"
      }
    ],
    "depth_score": 0.2294,
    "stars": 2,
    "stars_continuous": 2.35,
    "quality_tier": "weak"
  },
  {
    "id": "a008",
    "question_id": "q02",
    "student_answer": "Inheritance allows a class to acquire the properties and methods of another class, while polymorphism allows objects of different classes to be treated through a common interface. For example, a Vehicle base class can be extended by Car and Truck subclasses that reuse its shared fields and methods. This is because inheritance promotes code reuse by letting subclasses build on a common parent instead of duplicating logic.",
    "reference_answer": "Inheritance allows a class to acquire the fields and methods of another class, enabling code reuse through a parent-child relationship. Polymorphism allows objects of different classes to be treated through a common interface, most commonly via method overriding, so that the same method call can produce different behavior depending on the runtime type of the object. Abstract classes and interfaces often combine both concepts by defining a shared contract that subclasses implement in their own way.",
    "concepts": [
      "inheritance",
      "polymorphism",
      "method overriding",